{
  "schema_version": "1",
  "blob_digest": "aaaaaaaaaaaaaaaaaaaaaaaaaaaaaaaaaaaaaaaaaaaaaaaaaaaaaaaaaaaaaaaa",
  "producer_id": "handcrafted_fixture_v1",
  "runtime_version": "handcrafted",
  "complete": true,
  "boundaries": [],
  "functions": [
    {
      "name": "branch_demo",
      "parameters": [],
      "entry_node_id": 0,
      "node_order": [0, 1, 2, 3, 4],
      "complete": true,
      "bindings": [],
      "boundaries": [],
      "nodes": [
        {
          "node_id": 0,
          "operation": {"op": "name_assign", "target": "flag", "constant_kind": "bool"},
          "span": {"start_byte": 0, "end_byte": 1, "start_line": 1, "end_line": 1, "start_column": 1, "end_column": 2},
          "successors": [{"kind": "sequential", "target_id": 1}]
        },
        {
          "node_id": 1,
          "operation": {"op": "if", "test_name": "flag"},
          "span": {"start_byte": 2, "end_byte": 10, "start_line": 2, "end_line": 2, "start_column": 1, "end_column": 9},
          "successors": [
            {"kind": "if_true", "target_id": 2},
            {"kind": "if_false", "target_id": 3}
          ]
        },
        {
          "node_id": 2,
          "operation": {"op": "name_assign", "target": "x", "constant_kind": "int"},
          "span": {"start_byte": 11, "end_byte": 20, "start_line": 3, "end_line": 3, "start_column": 1, "end_column": 9},
          "successors": [{"kind": "sequential", "target_id": 4}]
        },
        {
          "node_id": 3,
          "operation": {"op": "name_assign", "target": "x", "constant_kind": "int"},
          "span": {"start_byte": 21, "end_byte": 30, "start_line": 4, "end_line": 4, "start_column": 1, "end_column": 9},
          "successors": [{"kind": "sequential", "target_id": 4}]
        },
        {
          "node_id": 4,
          "operation": {"op": "return", "return_name": "x"},
          "span": {"start_byte": 31, "end_byte": 40, "start_line": 5, "end_line": 5, "start_column": 1, "end_column": 9},
          "successors": [{"kind": "return", "target_id": 4}]
        }
      ]
    }
  ]
}
